
SQL> create table bank_branch(
  2  branch_id varchar2(15),
  3  branch_name varchar2(15),
  4  branch_address varchar2(15),
  5  branch_city varchar2(15),
  6  branch_state varchar2(15),
  7  branch_open_date date
  8  );

Table created.

SQL> insert into bank_branch values('b001','boi','jagnathroad','rajkot','gujarat','22-mar-2015');

1 row created.

SQL> insert into bank_branch values('b002','sbi','boriwaliroad','mumbai','maharastra','12-jan-2000');

1 row created.


SQL> insert into bank_branch values('b003','hdfc','agraroad','agra','up','04-feb=1998');

1 row created.

SQL> insert into bank_branch values('b004','denabank','cgroad','ahmedabad','gujarat','20-sep-2012');

1 row created.

SQL> insert into bank_branch values('b005','icici','majavdiroad','junagadh','gujarat','07-may-2011');

1 row created.

SQL> select * from bank_branch;

BRANCH_ID       BRANCH_NAME     BRANCH_ADDRESS  BRANCH_CITY     BRANCH_STATE
--------------- --------------- --------------- --------------- ---------------
BRANCH_OP
---------
b001            boi             jagnathroad     rajkot          gujarat
22-MAR-15

b002            sbi             boriwaliroad    mumbai          maharastra
12-JAN-00

b003            hdfc            agraroad        agra            up
04-FEB-98


BRANCH_ID       BRANCH_NAME     BRANCH_ADDRESS  BRANCH_CITY     BRANCH_STATE
--------------- --------------- --------------- --------------- ---------------
BRANCH_OP
---------
b004            denabank        cgroad          ahmedabad       gujarat
20-SEP-12

b005            icici           majavdiroad     junagadh        gujarat
07-MAY-11


SQL> select branch_id
  2  from bank_branch;

BRANCH_ID
---------------
b001
b002
b003
b004
b005

SQL> select branch_id,branch_address
  2  from bank_branch;

BRANCH_ID       BRANCH_ADDRESS
--------------- ---------------
b001            jagnathroad
b002            boriwaliroad
b003            agraroad
b004            cgroad
b005            majavdiroad

SQL> select branch_name,branch_address,branch_city
  2  from bank_branch;

BRANCH_NAME     BRANCH_ADDRESS  BRANCH_CITY
--------------- --------------- ---------------
boi             jagnathroad     rajkot
sbi             boriwaliroad    mumbai
hdfc            agraroad        agra
denabank        cgroad          ahmedabad
icici           majavdiroad     junagadh

SQL> select branch_city,branch_state,branch_open_date
  2  from bank_branch;

BRANCH_CITY     BRANCH_STATE    BRANCH_OP
--------------- --------------- ---------
rajkot          gujarat         22-MAR-15
mumbai          maharastra      12-JAN-00
agra            up              04-FEB-98
ahmedabad       gujarat         20-SEP-12
junagadh        gujarat         07-MAY-11

SQL> select * from bank_branch order by branch_id;

BRANCH_ID       BRANCH_NAME     BRANCH_ADDRESS  BRANCH_CITY     BRANCH_STATE
--------------- --------------- --------------- --------------- ---------------
BRANCH_OP
---------
b001            boi             jagnathroad     rajkot          gujarat
22-MAR-15

b002            sbi             boriwaliroad    mumbai          maharastra
12-JAN-00

b003            hdfc            agraroad        agra            up
04-FEB-98


BRANCH_ID       BRANCH_NAME     BRANCH_ADDRESS  BRANCH_CITY     BRANCH_STATE
--------------- --------------- --------------- --------------- ---------------
BRANCH_OP
---------
b004            denabank        cgroad          ahmedabad       gujarat
20-SEP-12

b005            icici           majavdiroad     junagadh        gujarat
07-MAY-11


SQL> select * from bank_branch order by branch_name;

BRANCH_ID       BRANCH_NAME     BRANCH_ADDRESS  BRANCH_CITY     BRANCH_STATE
--------------- --------------- --------------- --------------- ---------------
BRANCH_OP
---------
b001            boi             jagnathroad     rajkot          gujarat
22-MAR-15

b004            denabank        cgroad          ahmedabad       gujarat
20-SEP-12

b003            hdfc            agraroad        agra            up
04-FEB-98


BRANCH_ID       BRANCH_NAME     BRANCH_ADDRESS  BRANCH_CITY     BRANCH_STATE
--------------- --------------- --------------- --------------- ---------------
BRANCH_OP
---------
b005            icici           majavdiroad     junagadh        gujarat
07-MAY-11

b002            sbi             boriwaliroad    mumbai          maharastra
12-JAN-00


SQL> select * from bank_branch order by branch_city;

BRANCH_ID       BRANCH_NAME     BRANCH_ADDRESS  BRANCH_CITY     BRANCH_STATE
--------------- --------------- --------------- --------------- ---------------
BRANCH_OP
---------
b003            hdfc            agraroad        agra            up
04-FEB-98

b004            denabank        cgroad          ahmedabad       gujarat
20-SEP-12

b005            icici           majavdiroad     junagadh        gujarat
07-MAY-11


BRANCH_ID       BRANCH_NAME     BRANCH_ADDRESS  BRANCH_CITY     BRANCH_STATE
--------------- --------------- --------------- --------------- ---------------
BRANCH_OP
---------
b002            sbi             boriwaliroad    mumbai          maharastra
12-JAN-00

b001            boi             jagnathroad     rajkot          gujarat
22-MAR-15


SQL> select * from bank_branch order by branch_state;

BRANCH_ID       BRANCH_NAME     BRANCH_ADDRESS  BRANCH_CITY     BRANCH_STATE
--------------- --------------- --------------- --------------- ---------------
BRANCH_OP
---------
b001            boi             jagnathroad     rajkot          gujarat
22-MAR-15

b005            icici           majavdiroad     junagadh        gujarat
07-MAY-11

b004            denabank        cgroad          ahmedabad       gujarat
20-SEP-12


BRANCH_ID       BRANCH_NAME     BRANCH_ADDRESS  BRANCH_CITY     BRANCH_STATE
--------------- --------------- --------------- --------------- ---------------
BRANCH_OP
---------
b002            sbi             boriwaliroad    mumbai          maharastra
12-JAN-00

b003            hdfc            agraroad        agra            up
04-FEB-98

SQL> alter table bank_branch modify branch_state varchar(40);

Table altered.


SQL> update bank_branch set branch_name='union' where branch_id='b003';

1 row updated.


SQL> update bank_branch set branch_state='delhi' where branch_state='gujarat';

3 rows updated.

SQL> select * from bank_branch;

BRANCH_ID       BRANCH_NAME     BRANCH_ADDRESS  BRANCH_CITY
--------------- --------------- --------------- ---------------
BRANCH_STATE                             BRANCH_OP
---------------------------------------- ---------
b001            boi             jagnathroad     rajkot
delhi                                    22-MAR-15

b002            sbi             boriwaliroad    mumbai
maharastra                               12-JAN-00

b003            union           agraroad        agra
up                                       04-FEB-98


BRANCH_ID       BRANCH_NAME     BRANCH_ADDRESS  BRANCH_CITY
--------------- --------------- --------------- ---------------
BRANCH_STATE                             BRANCH_OP
---------------------------------------- ---------
b004            denabank        cgroad          ahmedabad
delhi                                    20-SEP-12

b005            icici           majavdiroad     junagadh
delhi                                    07-MAY-11


SQL> update bank_branch set branch_open_date='04-nov-2015' where branch_open_date='04-feb-1998';

1 row updated.

SQL> alter table bank_branch
  2  add pincode varchar(15);

Table altered.

SQL> desc bank_branch;
 Name                                      Null?    Type
 ----------------------------------------- -------- ----------------------------
 BRANCH_ID                                          VARCHAR2(15)
 BRANCH_NAME                                        VARCHAR2(15)
 BRANCH_ADDRESS                                     VARCHAR2(15)
 BRANCH_CITY                                        VARCHAR2(15)
 BRANCH_STATE                                       VARCHAR2(40)
 BRANCH_OPEN_DATE                                   DATE
 PINCODE                                            VARCHAR2(15)

SQL> insert into bank_branch values('b004','denabank','cgroad','ahmedabad','gujarat','20-sep-2012','360006');

1 row created.

SQL> select* from bank_branch;

BRANCH_ID       BRANCH_NAME     BRANCH_ADDRESS  BRANCH_CITY
--------------- --------------- --------------- ---------------
BRANCH_STATE                             BRANCH_OP PINCODE
---------------------------------------- --------- ---------------
b001            boi             jagnathroad     rajkot
delhi                                    22-MAR-15

b002            sbi             boriwaliroad    mumbai
maharastra                               12-JAN-00

b003            union           agraroad        agra
up                                       04-NOV-15


BRANCH_ID       BRANCH_NAME     BRANCH_ADDRESS  BRANCH_CITY
--------------- --------------- --------------- ---------------
BRANCH_STATE                             BRANCH_OP PINCODE
---------------------------------------- --------- ---------------
b004            denabank        cgroad          ahmedabad
delhi                                    20-SEP-12

b005            icici           majavdiroad     junagadh
delhi                                    07-MAY-11

b004            denabank        cgroad          ahmedabad
gujarat                                  20-SEP-12 360006


6 rows selected.

SQL> delete from bank_branch where branch_open_date='07-may-2011';

1 row deleted.


SQL> rename bank_branch to branch_master;

Table renamed.

SQL> desc branch_master;
 Name                                      Null?    Type
 ----------------------------------------- -------- ----------------------------
 BRANCH_ID                                          VARCHAR2(15)
 BRANCH_NAME                                        VARCHAR2(15)
 BRANCH_ADDRESS                                     VARCHAR2(15)
 BRANCH_CITY                                        VARCHAR2(15)
 BRANCH_STATE                                       VARCHAR2(40)
 BRANCH_OPEN_DATE                                   DATE
 PINCODE                                            VARCHAR2(15)

SQL> create table branch_info as select* from branch_master;

Table created.

SQL> commit;

Commit complete






































































































































































































